{
  "id": "EVD-0002",
  "tier": "T3",
  "producedBy": "balance-simulator",
  "at": "2026-08-27T13:12:31Z",
  "verdict": "pass",
  "summary": "G4 structural invariants, local verification",
  "commit": "fccdbcb",
  "seed": 12345,
  "metrics": {
    "determinismDivergences": 0,
    "dpsTier1": 20,
    "dpsTierMax": 24145.388672,
    "meanSpawnsPerRun": 60,
    "minDpsGrowthPerTier": 2.2,
    "seedsSwept": 100,
    "simulatedSecondsPerSeed": 120,
    "spawnsAt240fps": 60,
    "spawnsAt30fps": 60,
    "spawnsPerMinute": 30,
    "worstMergePremium": 1.1
  }
}
